,id,stars,results,scores,comment,url
143,144,5,积极,0.5,"An interesting story, and is a must-read for anyone majoring in history. This is THE story of China blending their animism with Buddhism, Confucianism, and Taoism.",https://www.amazon.com/Monkey-Journey-West-David-Kherdian/product-reviews/1590302583/ref=cm_cr_arp_d_paging_btm_next_2?pageNumber=2
144,145,5,积极,0.11666666666666665,"It was probably the longest book I've ever read and I'm a voracious reader. Growing up in Chinese martial arts with a Taoist Si Fu and Buddhist Si Mu, learning forms named after Sun Wukong and Immortals, this book hit a sweet spot called home.",https://www.amazon.com/Monkey-Journey-West-David-Kherdian/product-reviews/1590302583/ref=cm_cr_arp_d_paging_btm_next_2?pageNumber=2
145,146,5,积极,0.10185185185185185,"I tend to take forever finishing a book, but this was such an enjoyable read I couldn't put it down!",https://www.amazon.com/Monkey-Journey-West-David-Kherdian/product-reviews/1590302583/ref=cm_cr_arp_d_paging_btm_next_2?pageNumber=2
146,147,4,积极,0.31666666666666665,"I really enjoyed it, but there are too many long shots when nothing happens",https://www.amazon.com/Monkey-Journey-West-David-Kherdian/product-reviews/1590302583/ref=cm_cr_arp_d_paging_btm_next_2?pageNumber=2
147,148,4,积极,0.05,one of four classics of ancient Chinese literature gives insight into the cultural outlook on self improvement with charm and humor,https://www.amazon.com/Monkey-Journey-West-David-Kherdian/product-reviews/1590302583/ref=cm_cr_arp_d_paging_btm_next_2?pageNumber=2
148,149,5,积极,0.43,Loved it. Highly suggest.,https://www.amazon.com/Monkey-Journey-West-David-Kherdian/product-reviews/1590302583/ref=cm_cr_arp_d_paging_btm_next_2?pageNumber=2
149,150,5,积极,0.625,Amazing book! So glad I found it again.,https://www.amazon.com/Monkey-Journey-West-David-Kherdian/product-reviews/1590302583/ref=cm_cr_arp_d_paging_btm_next_2?pageNumber=2
150,151,4,积极,0.19,"A fantastic, epic tale. If you saw the TV show in the Eighties you'll love the book. It brings Monkey & all your favourites back to life.",https://www.amazon.com/Monkey-Journey-West-David-Kherdian/product-reviews/1590302583/ref=cm_cr_arp_d_paging_btm_next_3?pageNumber=3
151,152,5,积极,0.455,"This book is remarkable, highly recommend",https://www.amazon.com/Monkey-Journey-West-David-Kherdian/product-reviews/1590302583/ref=cm_cr_arp_d_paging_btm_next_3?pageNumber=3
152,153,5,积极,0.8,Great.,https://www.amazon.com/Monkey-Journey-West-David-Kherdian/product-reviews/1590302583/ref=cm_cr_arp_d_paging_btm_next_3?pageNumber=3
153,154,4,积极,0.3277777777777778,"It is an amazing story with a lot of interesting characters not found in Western literature. If you want to understand Chinese religion, mainly Buddhism and Daoism, this is a good place to start.",https://www.amazon.com/Monkey-Journey-West-David-Kherdian/product-reviews/1590302583/ref=cm_cr_arp_d_paging_btm_next_3?pageNumber=3
154,155,5,积极,0.35,TRUE ENLIGHTENMENT...,https://www.amazon.com/Monkey-Journey-West-David-Kherdian/product-reviews/1590302583/ref=cm_cr_arp_d_paging_btm_next_3?pageNumber=3
155,156,4,积极,0.26666666666666666,"Brilliant, witty, touching, and ridiculous. I loved it. I'll read it again. The boring bits can be breezed through, all in all an amazing read",https://www.amazon.com/Monkey-Journey-West-David-Kherdian/product-reviews/1590302583/ref=cm_cr_arp_d_paging_btm_next_3?pageNumber=3
156,157,5,积极,0.42499999999999993,"Real nice, been looking for it for a long time",https://www.amazon.com/Monkey-Journey-West-David-Kherdian/product-reviews/1590302583/ref=cm_cr_arp_d_paging_btm_next_3?pageNumber=3
157,158,3,积极,0.17916666666666667,"This book is one of the '4 classics' that Chinese children are studying during their school education. This one is probably too far from the Western cultural roots to make an easy reading, yet it is worth the patience (and sometimes the pain to go through some lengthy descriptions of places, costumes, characters...) for a Westerner seeking to better understand the Chinese psyche.",https://www.amazon.com/Monkey-Journey-West-David-Kherdian/product-reviews/1590302583/ref=cm_cr_arp_d_paging_btm_next_3?pageNumber=3
158,159,4,积极,0.1151256613756613,"This is a challenging book to review in that it is long, as are the other classic Chinese epics (Three Kingdoms, Outlaws of the Marsh and Dream of the Red Chamber) and accordingly contains much that will on the one hand provoke, entertain and inspire the modern reader while also containing much many are likely to find infuriating.  The basic plot is simple and well-known (and easily researchable on Wikipedia and other web sites). An emperor of China's Tang dynasty, seeking enlightenment for his kingdom, appoints a monk to journey to the west (India) to worship the Buddha and bring back the scripture. The monk has four disciples (fallen beings who are being given a chance to redeem themselves) who help him. These are the Monkey King, the Pig, and Friar Sand, and the horse. Pig and Friar Sand were heavenly Generals who messed up and were put into the bodies of animals. The horse is a dragon who is working off a sin by being in the body of a horse. Monkey was born of stone and is redeeming himself after having caused considerable chaos in and even revolted against heaven, taking on everybody there including the Jade Emperor (a stand-in, it seems, for God).  This is based on a true story wherein a Tang emperor really did send a monk on a mission to bring back Buddhist scripture, and also gather information (a Lewis & Clark type exploratory mission). It's a long trip accomplished on foot and for the monk, horseback (the main modes of transportation back then). The disciples can travel via cloud, but not the monk. But in the epic, the length of the trip is the least of the challenges. Again and again and again the party is beset by demons many of whom want to eat the monk's flesh in order to gain eternal life (something that is said to be possible given the monk's purity). Unlike other famous fictional voyagers, though, this monk couldn't fight his way out from under a grain of rice. He spends pretty much the entire epic weeping and complaining. It's mainly Monkey, helped more or less (emphasis on 'less') by the other disciples, that constantly has to overcome the obstacles.  The points of interest, the good parts, come from the nature of the adventures (quite varied and imaginative) and perhaps more important, the key relationships: between Monkey and the Monk, between Monkey and the assortment of deities, and between Monkey and the other disciples.  The monk is the prototypical whiney nerd. As mentioned, his specialties are weeping and complaining. Moreover, he is fooled by more illusions than a ten-year-old at a cheap magic show; actually, he's fooled by all illusions. Monkey, on the other hand, is the one who 'gets it.' His ability to see what's real isn't quite 100%, but its close and even when he errs, he corrects himself very quickly. He is, perhaps, the single greatest, most skilled, and most powerful (lots of magic powers) sidekick in all of literature (East or West).  So you'd think the Monk would revere and trust Monkey, right? Not so. The Monk does not trust Monkey at all and rejects his advice every time, until he gets into a mess and has no choice to do what Monkey demands in order to escape the crisis, only to distrust Monkey again next time. Twice in the epic, Monk gets so angry at what he perceives to be a bad attitude on the part of Monkey, he fires him (kicks him out of the expedition), but, of course, is force to be reconciled lest he wind up as dinner for a monster. But the Monk just doesn't learn. He continually trusts Pig, whose main concern is his own indulgence. As to capabilities, Pig is OK, but a distant second behind Monkey.  I'm not sure why the author fusses about the horse and Friar Sand. Neither has any discernable personality and both seem to be there just to carry stuff. And this is where we begin to get into things that may annoy a modern Western reader. The practice of the art of fiction here is not what we're used to.  The epic relies a lot, and I mean A HECK Of A LOT on a fictional technique known as 'deus ex machina' which translates literally to 'God out of the machine.' It's well known in ancient Greek theater. The author sets up a fascinating plot conflict and then finds himself unable to logically solve it, so an actor playing one the Gods is lowered to the scene from a set of pulleys (the machine) to sort everything out. The Greeks get away with it because the conflict is usually more important than the details of how it's resolved, but even they don't completely escape criticism. In this epic, 'deus ex machina' is used constantly. Like the Greeks, conflict and escape are paramount, but with the Greeks, you get one 'deus ex machina' instance per play. Here, it bombards you again and again and again time after time after time in the same epic to the point where it becomes tempting to skip ahead once the conflict is established because you pretty much know what's coming.  In fact, the adventures get so formulaic after a while, you may wonder if this is really a single epic, or something that was cobbled together from a lot of separate adventure stories. I have no idea what the answer is, but in the work handed down to us, the end implies it is a unified epic and that the crises were orchestrated from heaven to enable the Monk to become worthy of receiving the scriptures. But again, I can't swear this wasn't grafted on at a later time. One of the things that leads me to wonder about this being a unified epic is the way the Monk fails to even start to come to grips with Monkey's merits until the very end. To a modern Western reader, that defies belief, and having read other ancient Chinese epics, I'm not in a hurry to attribute such shallow characterization to the epic's different time and place. Also, the underdeveloped characterizations of Friar Sand and the horse lead me to wonder if they were developed in other segments of the story that got lost, or if the author intended to flash them out but never got around to it.  It's important to note that my speculations as to whether this is a unified work or something that was patched together is just that, personal speculation. I have absolutely no clue about the facts and haven't (at least not yet) even checked to see if there's any research pointing one way or another. What I'm suggesting to you, as a reader of this review, is to draw conclusions about the fact that I am so wrapped up in speculations like this. That tells you a lot about how the work is organized, and how reading it feels as you get beyond the 22-chapters of introductory material.  Clearly, though, the most intriguing character, and the one that makes the whole thing worthwhile is Monkey. His evolution from literature's most potent a**-hole to its most potent protector is riveting and addictive. It's a fascinating object lesson to anyone who has occasion to deal with difficult but talented people. The end of the story implies the monk needed to suffer to earn the right to get the scriptures. We modern folks, though, don't need to go through that. We can, if we wish, try to recognize the merit around us without constantly bringing ourselves to the brink of destruction.",https://www.amazon.com/Monkey-Journey-West-David-Kherdian/product-reviews/1590302583/ref=cm_cr_arp_d_paging_btm_next_3?pageNumber=3
159,160,1,消极,-0.125,Lost too much stuff including some most core stories. The pictures do not fit their descriptions. The worst version I have ever seen.,https://www.amazon.com/Monkey-Journey-West-David-Kherdian/product-reviews/1590302583/ref=cm_cr_arp_d_paging_btm_next_3?pageNumber=3
160,161,3,积极,0.05851648351648352,"Monkey was not exactly what I was expecting.  From the description, I thought this story would be heavily involved in Eastern Philosohpy, and use analogies to explain the Buddhist, Taoist, and Confucianist dogmas. Instead, the majority of the book describes the dozens of battles between monkey and various demons and spirits.  The specifics/tactics of these battles are described, including weapons (axes, swords, maces, monkey's cudgel, etc.), the magical transformations used (monkey growing to 10000 feet tall, or turning into a bird, etc.), and the status of the battle (300 rounds and no-one gaining an advantage, the opponents head being chopped off, etc.). Although there is some discussion of monkey's training in 'The Way' (with some Taoist and Confucianist ideas), and some of the Buddhist theories (right action, non-violence), the story is more focused on the adventures and battles of monkey and his master, who is searching for Buddhist scrolls.",https://www.amazon.com/Monkey-Journey-West-David-Kherdian/product-reviews/1590302583/ref=cm_cr_arp_d_paging_btm_next_4?pageNumber=4
161,162,4,积极,0.1564102564102564,"This is one of my favorite books that I will very seldom recommend to people. The reason for this is that while I found the long tangents, odd storylines, quirky characters, and great length of the book to be fantastically entertaining, I recognize that it is a very peculiar combination of elements that might not sit well with some. The book can also be somewhat repetitive on a superficial level, though there was enough variance in each story to keep me interested. The book also can be rather long-winded at times, but it's often in a funny way.",https://www.amazon.com/Monkey-Journey-West-David-Kherdian/product-reviews/1590302583/ref=cm_cr_arp_d_paging_btm_next_4?pageNumber=4
162,163,3,积极,0.2555764411027569,"This is a decent telling of the Chinese story, but it doesn't deliver on its own promises: Kherdian says that he includes more episodes and more of the spiritual aspects of the story than are found in the famous Arthur Waley version, but sadly, he does no such thing (especially in a crucial and famous scene toward the end). Kherdian's version is certainly readable and enjoyable, but Waley's is more thorough and includes more of the religious elements of the original. However, Kherdian's version may be better for younger readers than Waley's as, of the two abridgements, it is the easier to read.",https://www.amazon.com/Monkey-Journey-West-David-Kherdian/product-reviews/1590302583/ref=cm_cr_arp_d_paging_btm_next_4?pageNumber=4
163,164,5,积极,0.36590909090909096,"I just love the TV series monkey and the book is just as interesting. I found a really old copy at a junk sale. Before that I had no idea of the origin of the series. I just thought is was an amusing variation on samurai, ninja type themes. The original text is, however, the reason for the depth of philosophical thought which the series contains. I have no idea whether the philosophy goes into kids heads, or straight over them, but they seem to love it and the book makes great bedtime reading for children who love the series.",https://www.amazon.com/Monkey-Journey-West-David-Kherdian/product-reviews/1590302583/ref=cm_cr_arp_d_paging_btm_next_4?pageNumber=4
164,165,4,积极,0.15364583333333331,"Monkey King is one of the 4 top classics in Chinese literature. All my friends in Beijing told me I should read it first of the 4, and they chose well. Akin to the Wizard of Oz in America, the story has many layers of meaning, and provides significant insight into Chinese culture and thought patterns, past and present. The story is easy to pick up and follow in episodes. I will confess that I skipped over some of the flowery (and lengthy) descriptive poetic sections, but this is a good read. This edition is marred by having no good navigation system, and by  occasionalrandom misspellings (due to the linguistic mindset of the Chinese translator/s).",https://www.amazon.com/Monkey-Journey-West-David-Kherdian/product-reviews/1590302583/ref=cm_cr_arp_d_paging_btm_next_4?pageNumber=4
165,166,2,积极,0.19861111111111115,"This translation of the classic Chinese novel is not nearly as good as the previous Arthur Waley edition, also available from Amazon.  This edition has the advantage of being greatly simplified, and therefore may be more suitable for young readers.  Fans of the Waley edition might also be interested in this edition as a source for a few slightly different stories selected from the much longer original.  However, this edition eliminates much of the texture of the original and is overall much, much shorter than Waley's.  Most readers would be far wiser to choose Waley's classic edition.  This is a poor substitute at best, except possibly for children.",https://www.amazon.com/Monkey-Journey-West-David-Kherdian/product-reviews/1590302583/ref=cm_cr_arp_d_paging_btm_next_4?pageNumber=4
166,167,4,积极,0.3416666666666666,"If  you are a huge fan of the Journey to the West do not purchase this abridgement, buy the whole 3-4 volume set also available on Amazon.  Otherwise the translation and abridgement here is fine for a quick, fun read.",https://www.amazon.com/Monkey-Journey-West-David-Kherdian/product-reviews/1590302583/ref=cm_cr_arp_d_paging_btm_next_4?pageNumber=4
167,168,3,积极,0.10468750000000002,"While this is the only version of the Monkey King story that I have read, I have read other Eastern philosophy stories, and I have to say that this version is definitely the most readable of all of them. That being said, I did find the story to be a little light on the Eastern wisdom it was meant to deliver. However, if you're looking for a fun story based on some Eastern principles to read to your children, this could be it.",https://www.amazon.com/Monkey-Journey-West-David-Kherdian/product-reviews/1590302583/ref=cm_cr_arp_d_paging_btm_next_4?pageNumber=4
168,169,5,积极,0.28736263736263734,"This book is fantastic, It's a great read but thats just me because I love Asian myth's and things of the sort. But few know that this book is the basis of the incredibley popular anime Dragon Ball Z. Yes thats right, im not making this up this is 100% true. If you look up the story for dragon ball, the first in the series of dbz, you will find that it is incredibley similar to this book. Monkey represents Son Gokou, the pig represents oolong, the great king of the mountain is ox king. If you are a big time DBZ fan like me, read this book and find out the origin.",https://www.amazon.com/Monkey-Journey-West-David-Kherdian/product-reviews/1590302583/ref=cm_cr_arp_d_paging_btm_next_4?pageNumber=4
169,170,4,积极,0.2728236607142857,I waiting a long time to read this book imswr very interested in Chinese mythology so far I have enjoyed the story..thank you Amazon for your prompt service I also have a kindle fire wihich I also enjoy very much!!!!,https://www.amazon.com/Monkey-Journey-West-David-Kherdian/product-reviews/1590302583/ref=cm_cr_arp_d_paging_btm_next_4?pageNumber=4
170,171,1,消极,-0.005000000000000016,I downloaded the sample for this and found the TOC worthless. Chapter 1 to Chapter 100 are listed. But they aren't even hyperlinked. Any other decent sample book I've tried has a hyperlinked TOC. I deleted it then and there. Found a free copy elsewhere on the web with hyperlinks and even quick chapter summaries. That one's a keeper.,https://www.amazon.com/Monkey-Journey-West-David-Kherdian/product-reviews/1590302583/ref=cm_cr_arp_d_paging_btm_next_5?pageNumber=5
171,172,5,积极,0.33999999999999997,"I really loved this book, it passed the time really fast and I liked the book so much I finished it in only 10 hours.",https://www.amazon.com/Monkey-Journey-West-David-Kherdian/product-reviews/1590302583/ref=cm_cr_arp_d_paging_btm_next_5?pageNumber=5
172,173,5,积极,0.595,"This was a book used by my history class, used to depict Buddhist, Daoist, and Confucianist ideals. This is a very fun read, the chapters just fly by.",https://www.amazon.com/Monkey-Journey-West-David-Kherdian/product-reviews/1590302583/ref=cm_cr_arp_d_paging_btm_next_5?pageNumber=5
173,174,5,积极,0.13809523809523808,"[The Journey to the West (西遊記) is so well-known a story in Chinese culture that I won't bother to review the story as such, but will focus on the translation.  This book is the first volume of a four-volume translation.  This review covers all four volumes.]  Any translation of a literary work, let alone between languages as different as Chinese and English are, is an exercise in compromise and cleverness.  A particular sentence in Chinese—even a single phrase—can be rendered in numerous ways in English, each one of them carrying a different set of nuances.  To maintain narrative flow, though, the translator must choose just one of those ways, which represents an indelible choice as to what aspect of the original will be conveyed to the reader.  That is the compromise.  The cleverness comes in the insight and deftness with which the translator crafts and arranges those choices into a coherent whole.  It is said that one should always translate into one's 'A language'—that is, the language in which one is most fluent.  But Dr Anthony Yu was a native Chinese speaker, and although years of teaching in the United States made him fluent in English, it was still not his primary language.  It is a testament to his genius and his decades of work on this, a story that he describes as near and dear to his heart, that this English version is as faithful to the Chinese original as can be hoped, and yet reads as sprightly and as uproariously as though it were, in fact, the original.  Something must be done with those nuances, though.  Some translators choose to insert them directly into the body of the work, as Howard Goldblatt does in his translation of Mo Yan's Life and Death are Wearing Me Out.  But perhaps The Journey to the West is too full of Buddhist, Daoist, and other cultural allusions for them to be adequately captured in a passing sentence.  So Yu's translation is copiously endnoted, and these notes are full of fascinating material on the religious and philosophical environment in which both the story is written and its action takes place.  Included also are scholarly citations that justify, with a degree of rigor that will probably be overlooked by the average reader, all the various word and phrasing choices he made.  In some cases, Yu's study has even found errors in the original text.  The first volume of this translation adds an introduction that describes the textual history of this story, Wu Cheng'en's presumed authorship, biographical sketches of the real people depicted in the novel, and Wu's motivations for writing it, and them, the way that he did.  These additions admirably fill out the narrative and setting delivered to us so seamlessly by Yu.  Other translations may have quainter charm or somewhat more fluid English, but this one provides such a complete perspective on the novel that it presents itself immediately as the de facto standard.  A must have for the dedicated reader.",https://www.amazon.com/Journey-West-Revised-1/product-reviews/0226971325/ref=cm_cr_arp_d_paging_btm_next_1?pageNumber=1
174,175,3,积极,0.09544817927170868,"'The Journey to the West' is a lengthy 16th century novel, regarded as one of the four great classics of Chinese literature. The author of the book is uncertain, but is thought to be Wu Cheng'en. This volume contains the first twenty-five chapters of the hundred-chapter narrative, plus extensive notes and a ninety-six-page introduction by the translator, Anthony C. Yu. I found the introduction a difficult read, no doubt due to my prior ignorance about almost everything it covered. But the introduction was helpful, and I am glad I labored through it.  The book itself defied my expectations. It was neither dry, nor dense, nor inscrutable. To my surprise, it appears to have been intended to be fun, and, despite the intervening centuries, I often found it such. The narrative is a fantastical retelling of Xuanzang's pilgrimage to India to obtain Buddhist scriptures, a pilgrimage that took place roughly a thousand years before 'The Journey to the West' was written. In the retelling, there are gods, monsters, dragons, trickery, humor, and a plethora of epic fights. There is also a remarkably large amount of poetry, serving both as description and commentary, and the poetry lightened the reading. Since this volume contains only the first quarter of the story, I will postpone further comments for now.",https://www.amazon.com/Journey-West-Revised-1/product-reviews/0226971325/ref=cm_cr_arp_d_paging_btm_next_1?pageNumber=1
175,176,5,积极,0.03392857142857143,"I've read Journey to the West, Yu's translation, every few years for the last decade or so now. It's wonderful, and improves with every reading. There are layers of meaning, and I really appreciate Yu's scholarly footnotes. Unfortunately, the Kindle version is a bit of a mess. The Chinese characters are FAR too small to read (they're smaller than the smallest-size font, and can't be resized). This is extremely frustrating, since much of the word-play, and some of the important concepts hinge on the characters used. This needs to be fixed.  I'd say, if you haven't read Journey to the West, read it. But stick with paper for the time being.",https://www.amazon.com/Journey-West-Revised-1/product-reviews/0226971325/ref=cm_cr_arp_d_paging_btm_next_1?pageNumber=1
